{
    "platformName": "rpi4_64_reference",
    "os": "linux",
    "arch": {
        "arch": "aarch64",
        "variant": "v8"
    },
    "rdk": {
        "version": "2024Q3",
        "supportedFeatures": [
            "DeviceInfo",
            "org.rdk.Network",
            "org.rdk.OCIContainer",
            "org.rdk.Proxies"
        ]
    },
    "hardware": {
            "graphics":false
    },
    "storage": {
        "persistent": {
            "storageDir": "/opt/dac_apps/data/0",
            "maxSize": "100M"
        }
    },
    "gpu": {
        "extraMounts": [
            {
                "source": "/etc/ssl/certs",
                "destination": "/etc/ssl/certs",
                "type": "bind",
                "options": [
                    "rbind",
                    "nosuid",
                    "nodev",
                    "ro",
                    "X-mount.mkdir"
                ]
            },
            {
                "source": "/usr/share/ca-certificates",
                "destination": "/usr/share/ca-certificates",
                "type": "bind",
                "options": [
                    "rbind",
                    "nosuid",
                    "nodev",
                    "ro",
                    "X-mount.mkdir"
                ]
            }
        ],
        "envvar": [
            "XDG_RUNTIME_DIR=/tmp"
        ],
        "devs": [
        ],
        "gfxLibs": [
        ]
    },
    "mounts": [
        {
            "source": "/usr/lib/libstdc++.so.6",
            "destination": "/usr/lib/libstdc++.so.6",
            "options": [
                "rbind",
                "nosuid",
                "nodev",
                "ro"
            ],
            "type": "bind"
        },
        {
            "source": "/lib/libgcc_s.so.1",
            "destination": "/lib/libgcc_s.so.1",
            "options": [
                "rbind",
                "nosuid",
                "nodev",
                "ro"
            ],
            "type": "bind"
        },
       {
            "source": "tmpfs",
            "destination": "/tmp",
            "options": [
                "nosuid",
                "strictatime",
                "mode=755",
                "size=65536k"
            ],
            "type": "tmpfs"
        }
    ],
    "network": {
        "options": [
            "nat",
            "open",
            "private"
        ]
    },
    "envvar": [
    ],
    "resourceLimits": [
        {
            "type": "RLIMIT_NPROC",
            "hard": 300,
            "soft": 300
        },
        {
            "type": "RLIMIT_RTPRIO",
            "hard": 6,
            "soft": 6
        }
    ],
    "disableUserNamespacing": true,
    "logging": {
        "mode": "file",
        "logDir": "/var/log"
    }
}
