{
    "platformName": "rpi3",
    "os": "linux",
    "arch": {
        "arch": "arm",
        "variant": "v7"
    },
    "rdk": {
        "version": "2020Q4",
        "supportedFeatures": [
            "Controller",
            "DeviceInfo",
            "Monitor",
            "OCDM",
            "TraceControl",
            "WifiManager",
            "com.comcast.CoPilot",
            "com.comcast.DeviceProvisioning",
            "com.comcast.FrameRate",
            "com.comcast.HdcpProfile",
            "com.comcast.HdmiInput",
            "com.comcast.StateObserver",
            "com.comcast.StorageManager",
            "org.rdk.ActivityMonitor",
            "org.rdk.DeviceDiagnostics",
            "org.rdk.DisplaySettings",
            "org.rdk.FrontPanel",
            "org.rdk.HomeNetworking",
            "org.rdk.LoggingPreferences",
            "org.rdk.Network",
            "org.rdk.OCIContainer",
            "org.rdk.Proxies",
            "org.rdk.SleepTimer",
            "org.rdk.TTSResource",
            "org.rdk.TTSSettings",
            "org.rdk.Timer",
            "org.rdk.UserPreferences",
            "org.rdk.Warehouse"
        ]
    },
    "hardware": {
        "graphics": true,
        "maxRam": "610M"
    },
    "storage": {
        "persistent": {
            "storageDir": "/tmp/data",
            "maxSize": "100M"
        }
    },
    "gpu": {
        "westeros": {
        },
        "extraMounts": [
        ],
        "envvar": [
            "LD_PRELOAD=/usr/lib/libwayland-client.so.0:/usr/lib/libwayland-egl.so.0"
        ],
        "devs": [
            {
                "type": "c",
                "path": "/dev/vchiq",
                "major": 245,
                "minor": 0,
                "access": "rw"
            }
        ],
        "gfxLibs": [
            {
                "src": "/usr/lib/libEGL.so",
                "dst": "/usr/lib/libEGL.so"
            },
            {
                "src": "/usr/lib/libEGL.so",
                "dst": "/usr/lib/libEGL.so.1"
            },
            {
                "src": "/usr/lib/libGLESv2.so",
                "dst": "/usr/lib/libGLESv2.so"
            },
            {
                "src": "/usr/lib/libGLESv2.so",
                "dst": "/usr/lib/libGLESv2.so.2"
            },
            {
                "src": "/usr/lib/libwayland-egl.so",
                "dst": "/usr/lib/libwayland-egl.so"
            },
            {
                "src": "/usr/lib/libwayland-egl.so.0",
                "dst": "/usr/lib/libwayland-egl.so.0"
            },
            {
                "src": "/usr/lib/libwayland-egl.so.0",
                "dst": "/usr/lib/libwayland-egl.so.1"
            },
            {
                "src": "/usr/lib/libbcm_host.so",
                "dst": "/usr/lib/libbcm_host.so"
            },
            {
                "src": "/usr/lib/libvchostif.so",
                "dst": "/usr/lib/libvchostif.so"
            },
            {
                "src": "/usr/lib/libvcos.so",
                "dst": "/usr/lib/libvcos.so"
            },
            {
                "src": "/usr/lib/libvchiq_arm.so",
                "dst": "/usr/lib/libvchiq_arm.so"
            },
            {
                "src": "/usr/lib/libwesteros_simpleshell_client.so.0",
                "dst": "/usr/lib/libwesteros_simpleshell_client.so.0"
            },
            {
                "src": "/usr/lib/libwayland-server.so.0",
                "dst": "/usr/lib/libwayland-server.so.0"
            }
        ]
    },
    "mounts": [],
    "network": {
        "options": [
            "nat",
            "open",
            "private"
        ]
    },
    "envvar": [
        "XDG_RUNTIME_DIR=/tmp"
    ],
    "resourceLimits": [
        {
            "type": "RLIMIT_NPROC",
            "hard": 300,
            "soft": 300
        },
        {
            "type": "RLIMIT_RTPRIO",
            "hard": 6,
            "soft": 6
        }
    ],
    "disableUserNamespacing": true,
    "logging": {
        "mode": "file",
        "logDir": "/var/log"
    },
    "dobby": {
        "pluginDir": "/usr/lib/plugins/dobby",
        "pluginDependencies": [
            "/lib/libc.so.6",
            "/lib/libdl.so.2",
            "/lib/libcap.so.2",
            "/lib/libgcc_s.so.1",
            "/lib/libm.so.6",
            "/lib/libpthread.so.0",
            "/lib/libresolv.so.2",
            "/lib/librt.so.1",
            "/lib/libsystemd.so.0",
            "/usr/lib/liblzma.so.5",
            "/usr/lib/libnl-3.so.200",
            "/usr/lib/libnl-route-3.so.200",
            "/usr/lib/libstdc++.so.6",
            "/usr/lib/libyajl.so.2",
            "/lib/ld-linux-armhf.so.3"
        ]
    }
}